{
  "schema_version": "1.0",
  "report_id": "REPORT-GOS-2026-09-01",
  "scope_id": "SCOPE-GOS-STOREFRONT",
  "project": "gamingops-store (authorized owner self-audit)",
  "mode": "LOCAL",
  "generated_at": "2026-09-01T14:20:00Z",
  "coverage": {
    "catalog_version": "2.2",
    "APPLICABLE": 41,
    "NOT_APPLICABLE": 496,
    "UNKNOWN": 8,
    "BLOCKED": 1,
    "TOTAL": 546,
    "integrity_critical_unknown": 0
  },
  "tools": [
    {
      "name": "next",
      "version": "16.2.7",
      "purpose": "Production build under test"
    },
    {
      "name": "vitest",
      "version": "3.2.7",
      "purpose": "Regression proof execution"
    },
    {
      "name": "chromium-devtools",
      "version": "playwright-mcp",
      "purpose": "Local framing reproduction and CSP refusal capture"
    },
    {
      "name": "curl",
      "version": "8.x",
      "purpose": "Response header observation"
    }
  ],
  "evidence": [
    {
      "schema_version": "1.0",
      "evidence_id": "EV-GOS-HEADERS-BASELINE",
      "kind": "OBSERVATION",
      "status": "CONFIRMED",
      "source": {
        "type": "RUNTIME",
        "name": "curl",
        "version": "8.x",
        "invocation": "curl -sI http://localhost:3006/",
        "collected_at": "2026-09-01T14:20:00Z",
        "provenance": "Authorized owner self-audit of gamingops-store at commit 06ab8ca; LOCAL execution mode only."
      },
      "summary": "The baseline build returned no Content-Security-Policy, X-Frame-Options, X-Content-Type-Options, Referrer-Policy, Strict-Transport-Security, or Permissions-Policy header, and advertised X-Powered-By: Next.js.",
      "environment": {
        "mode": "LOCAL",
        "scope_id": "SCOPE-GOS-STOREFRONT",
        "target_id": "TGT-GOS-STOREFRONT"
      },
      "artifacts": [
        {
          "name": "headers-before.txt",
          "media_type": "text/plain",
          "sha256": "29aaaf3bcb5489bc49b3ae19dfc66a3b709b8ed8f3d30f77bd5d13bd3d841687",
          "locator": "artifacts/case-studies/gamingops-store-2026-09-01/headers-before.txt"
        }
      ],
      "redactions": [
        "No customer data, credentials, or live exploit material is included."
      ]
    },
    {
      "schema_version": "1.0",
      "evidence_id": "EV-GOS-FRAME-REPRO",
      "kind": "REPRODUCTION",
      "status": "CONFIRMED",
      "source": {
        "type": "RUNTIME",
        "name": "chromium-framing-probe",
        "invocation": "local iframe probe page on 127.0.0.1:3007",
        "collected_at": "2026-09-01T14:20:00Z",
        "provenance": "Authorized owner self-audit of gamingops-store at commit 06ab8ca; LOCAL execution mode only."
      },
      "summary": "A third-party page on a different local origin embedded the storefront in an iframe and the full interface rendered, including the Sign in entry point.",
      "environment": {
        "mode": "LOCAL",
        "scope_id": "SCOPE-GOS-STOREFRONT",
        "target_id": "TGT-GOS-STOREFRONT"
      },
      "artifacts": [
        {
          "name": "clickjack-before.png",
          "media_type": "image/png",
          "sha256": "9571b3b07c247f22e0a17411f76a726905a2344aa5570afadfb3436c9eb35b46",
          "locator": "artifacts/case-studies/gamingops-store-2026-09-01/clickjack-before.png"
        }
      ],
      "redactions": [
        "No customer data, credentials, or live exploit material is included."
      ]
    },
    {
      "schema_version": "1.0",
      "evidence_id": "EV-GOS-ROOTCAUSE",
      "kind": "CONTEXT",
      "status": "CONFIRMED",
      "source": {
        "type": "REPOSITORY",
        "name": "next.config.ts",
        "invocation": "static review of next.config.ts@06ab8ca",
        "collected_at": "2026-09-01T14:20:00Z",
        "provenance": "Authorized owner self-audit of gamingops-store at commit 06ab8ca; LOCAL execution mode only."
      },
      "summary": "next.config.ts declared only an images block. The application defined no headers() policy, so no framing or content-security boundary was ever emitted.",
      "environment": {
        "mode": "STATIC",
        "scope_id": "SCOPE-GOS-STOREFRONT",
        "target_id": "TGT-GOS-STOREFRONT"
      },
      "artifacts": [],
      "redactions": [
        "No customer data, credentials, or live exploit material is included."
      ]
    },
    {
      "schema_version": "1.0",
      "evidence_id": "EV-GOS-REMEDIATION",
      "kind": "REMEDIATION",
      "status": "CONFIRMED",
      "source": {
        "type": "REPOSITORY",
        "name": "gamingops-store PR #2",
        "invocation": "git diff next.config.ts",
        "collected_at": "2026-09-01T14:20:00Z",
        "provenance": "Authorized owner self-audit of gamingops-store at commit 06ab8ca; LOCAL execution mode only."
      },
      "summary": "next.config.ts now returns a catch-all header rule carrying CSP with frame-ancestors 'none', X-Frame-Options DENY, nosniff, Referrer-Policy, Permissions-Policy, HSTS, and COOP, and disables poweredByHeader.",
      "environment": {
        "mode": "STATIC",
        "scope_id": "SCOPE-GOS-STOREFRONT",
        "target_id": "TGT-GOS-STOREFRONT"
      },
      "artifacts": [
        {
          "name": "headers-after.txt",
          "media_type": "text/plain",
          "sha256": "d4f6f7292a13ba1f399cbcebb6ffd0c3bc60c29ff78c68a32ef226711fe6ca1b",
          "locator": "artifacts/case-studies/gamingops-store-2026-09-01/headers-after.txt"
        }
      ],
      "redactions": [
        "No customer data, credentials, or live exploit material is included."
      ]
    },
    {
      "schema_version": "1.0",
      "evidence_id": "EV-GOS-REGRESSION",
      "kind": "REGRESSION",
      "status": "CONFIRMED",
      "source": {
        "type": "TEST",
        "name": "vitest",
        "version": "3.2.7",
        "invocation": "npx vitest run",
        "collected_at": "2026-09-01T14:20:00Z",
        "provenance": "Authorized owner self-audit of gamingops-store at commit 06ab8ca; LOCAL execution mode only."
      },
      "summary": "Ten regression assertions cover the header set, frame-ancestors, X-Frame-Options DENY, absence of X-Powered-By, and rejection of hostile URL schemes. Full suite 15/15 pass.",
      "environment": {
        "mode": "LOCAL",
        "scope_id": "SCOPE-GOS-STOREFRONT",
        "target_id": "TGT-GOS-STOREFRONT"
      },
      "artifacts": [
        {
          "name": "regression-after.txt",
          "media_type": "text/plain",
          "sha256": "78fa06fbf2bc376c86d2232b07784089187b96f3f1b27fdccd46f524aff0c38a",
          "locator": "artifacts/case-studies/gamingops-store-2026-09-01/regression-after.txt"
        }
      ],
      "redactions": [
        "No customer data, credentials, or live exploit material is included."
      ]
    },
    {
      "schema_version": "1.0",
      "evidence_id": "EV-GOS-RETEST",
      "kind": "VERIFICATION",
      "status": "CONFIRMED",
      "source": {
        "type": "RUNTIME",
        "name": "chromium-console",
        "invocation": "framing probe against the fixed build",
        "collected_at": "2026-09-01T14:20:00Z",
        "provenance": "Authorized owner self-audit of gamingops-store at commit 06ab8ca; LOCAL execution mode only."
      },
      "summary": "After a clean rebuild the browser refused the frame: \"Framing 'http://localhost:3009/' violates the following Content Security Policy directive: \\\"frame-ancestors 'none'\\\". The request has been blocked.\"",
      "environment": {
        "mode": "LOCAL",
        "scope_id": "SCOPE-GOS-STOREFRONT",
        "target_id": "TGT-GOS-STOREFRONT"
      },
      "artifacts": [
        {
          "name": "clickjack-after.png",
          "media_type": "image/png",
          "sha256": "a1a0ca0674c7b7c065994b3a6d925c8f576deed3f5bb3a687f1a6966c1bb71d4",
          "locator": "artifacts/case-studies/gamingops-store-2026-09-01/clickjack-after.png"
        }
      ],
      "redactions": [
        "No customer data, credentials, or live exploit material is included."
      ]
    },
    {
      "schema_version": "1.0",
      "evidence_id": "EV-GOS-URLSCHEME-REFUTATION",
      "kind": "VERIFICATION",
      "status": "REJECTED",
      "source": {
        "type": "RUNTIME",
        "name": "mock-store-config-api",
        "invocation": "node mock-work-api.mjs on 127.0.0.1:3999",
        "collected_at": "2026-09-01T14:20:00Z",
        "provenance": "Authorized owner self-audit of gamingops-store at commit 06ab8ca; LOCAL execution mode only."
      },
      "summary": "A hostile javascript: URL supplied through the remote store-config was rendered by React 19 as javascript:throw new Error('React has blocked a javascript: URL as a security precaution.'), so the suspected cross-site scripting path is not exploitable. Attacker control was also not established from the public internet.",
      "environment": {
        "mode": "LOCAL",
        "scope_id": "SCOPE-GOS-STOREFRONT",
        "target_id": "TGT-GOS-STOREFRONT"
      },
      "artifacts": [
        {
          "name": "urlscheme-refutation.txt",
          "media_type": "text/plain",
          "sha256": "620b623f42333d640a5df4d6166886f1d2d8b020b737e2eddd2c6ebeaff0b257",
          "locator": "artifacts/case-studies/gamingops-store-2026-09-01/urlscheme-refutation.txt"
        }
      ],
      "redactions": [
        "No customer data, credentials, or live exploit material is included."
      ]
    }
  ],
  "findings": [
    {
      "schema_version": "1.0",
      "finding_id": "SHX-F-GOS-HEADERS-001",
      "title": "Storefront declares no response security headers and can be framed by any origin",
      "status": "VERIFIED",
      "severity": "MEDIUM",
      "confidence": "HIGH",
      "catalog_hypothesis_ids": [
        "SHX-WEB-L08"
      ],
      "affected_surface": [
        "All storefront routes served by the Next.js application"
      ],
      "mappings": [
        "CWE-1021",
        "OWASP-ASVS:V14"
      ],
      "evidence_ids": [
        "EV-GOS-HEADERS-BASELINE",